{
  "id": "crashloop",
  "namespace": "orders",
  "live_only": false,
  "title": "Application crash loop",
  "report": "The orders-api keeps restarting and the orders page is down.",
  "category": "crashloop_app_error",
  "allowed": [
    "crashloop_app_error"
  ],
  "objects": [
    {
      "kind": "Deployment",
      "name": "orders-api",
      "affects": [],
      "also_accept": {
        "categories": [
          "config_missing"
        ],
        "why": "the only visible cause is the log line 'FATAL: DATABASE_URL is not set'; a missing setting is an equally supported reading"
      },
      "mechanism": {
        "facts": [
          {
            "id": "names the missing DATABASE_URL",
            "re": "DATABASE_URL"
          }
        ],
        "example": {
          "root_cause": "orders-api exits at start-up with 'FATAL: DATABASE_URL is not set', so its pod crash-loops",
          "fix": "set DATABASE_URL in the orders-api Deployment's environment"
        }
      }
    }
  ],
  "evidence": [
    "log"
  ],
  "must_call": [
    "list_problem_pods",
    "pod_logs"
  ],
  "apply": [
    "manifest.yaml"
  ],
  "cluster": "kind",
  "settle": "restarts>=2",
  "tier": "easy",
  "task_type": "investigate",
  "red_herrings": [],
  "also_ok": [],
  "forbidden": [],
  "hints": {}
}
