{
  "id": "mixed",
  "namespace": "ledger",
  "live_only": false,
  "title": "Two independent faults: crash loop and a service with no endpoints",
  "report": "The ledger area is broken: ledger crashes and the ledger-api service does not answer.",
  "category": "crashloop_app_error",
  "allowed": [
    "crashloop_app_error"
  ],
  "objects": [
    {
      "kind": "Deployment",
      "name": "ledger",
      "category": "crashloop_app_error",
      "affects": []
    },
    {
      "kind": "Service",
      "name": "ledger-api",
      "category": "service_no_endpoints",
      "affects": []
    }
  ],
  "evidence": [
    "log",
    "describe"
  ],
  "must_call": [
    "list_problem_pods",
    "pod_logs",
    "describe"
  ],
  "apply": [
    "manifest.yaml"
  ],
  "cluster": "kind",
  "settle": "restarts>=2",
  "tier": "easy",
  "task_type": "investigate",
  "red_herrings": [],
  "also_ok": [],
  "forbidden": [],
  "hints": {}
}
